{
  "$schema": "./sea-config.schema.json",
  "mainFormat": "module",
  "useCodeCache": true,
  "main": "./server/dist/server.js",
  "output": "./dist/percent-player",
  "disableExperimentalSEAWarning": true,
  "executable": "/usr/bin/node",
  "assets": {
    "assets/hero-CLDdwZDr.png": "./client/dist/assets/hero-CLDdwZDr.png",
    "assets/index-D64VDMd1.css": "./client/dist/assets/index-D64VDMd1.css",
    "assets/index-DaeTyWji.js": "./client/dist/assets/index-DaeTyWji.js",
    "assets/react-CHdo91hT.svg": "./client/dist/assets/react-CHdo91hT.svg",
    "assets/vite-BF8QNONU.svg": "./client/dist/assets/vite-BF8QNONU.svg",
    "favicon.svg": "./client/dist/favicon.svg",
    "icons.svg": "./client/dist/icons.svg",
    "index.html": "./client/dist/index.html"
  }
}